{
  "$schema": "https://json-schema.org/draft/2020-12/schema",
  "$id": "https://abraxas/contracts/canon/chamfer_expected_distance_policy_plan.v1.schema.json",
  "title": "ChamferExpectedDistancePolicyPlan.v1",
  "type": "object",
  "additionalProperties": false,
  "required": ["schema_version", "plan_id", "plan_type", "operator_id", "source_fixture_readiness_review_refs", "source_fixture_consolidation_receipt_refs", "source_valid_fixture_plan_refs", "source_invalid_fixture_plan_refs", "source_not_computable_fixture_plan_refs", "source_baseline_implementation_plan_refs", "policy_scope", "expected_distance_policy_groups", "tolerance_policy_plan", "not_computable_distance_policy", "review_gate_plan", "policy_constraints", "output_contract", "governance_flags", "provenance", "created_at_utc", "canonical_hash"],
  "properties": {
    "schema_version": {"const": "ChamferExpectedDistancePolicyPlan.v1"},
    "plan_id": {"type": "string", "minLength": 1},
    "plan_type": {"const": "CHAMFER_EXPECTED_DISTANCE_POLICY_PLAN"},
    "operator_id": {"const": "CHAMFER_DISTANCE"},
    "source_fixture_readiness_review_refs": {"type": "array", "items": {"type": "string", "minLength": 1}},
    "source_fixture_consolidation_receipt_refs": {"type": "array", "items": {"type": "string", "minLength": 1}},
    "source_valid_fixture_plan_refs": {"type": "array", "items": {"type": "string", "minLength": 1}},
    "source_invalid_fixture_plan_refs": {"type": "array", "items": {"type": "string", "minLength": 1}},
    "source_not_computable_fixture_plan_refs": {"type": "array", "items": {"type": "string", "minLength": 1}},
    "source_baseline_implementation_plan_refs": {"type": "array", "items": {"type": "string", "minLength": 1}},
    "policy_scope": {"type": "object", "additionalProperties": false, "required": ["policy_family", "intended_lane", "policy_stage"], "properties": {"policy_family": {"enum": ["EXPECTED_DISTANCE_POLICY", "FLOAT_TOLERANCE_POLICY", "NOT_COMPUTABLE_DISTANCE_POLICY", "REVIEW_GATE_POLICY", "MIXED_DISTANCE_POLICY_PLAN"]}, "intended_lane": {"enum": ["SHADOW", "PROJECTION", "OBSERVATION_ONLY"]}, "policy_stage": {"enum": ["POLICY_PLAN_ONLY", "EXPECTED_VALUE_HELD", "BLOCKED_PENDING_OPERATOR_REVIEW"]}}},
    "expected_distance_policy_groups": {"type": "array", "minItems": 1, "items": {"type": "object", "additionalProperties": false, "required": ["group_id", "group_type", "description", "applicable_fixture_family", "distance_value_status", "tolerance_required", "review_required", "implementation_status"], "properties": {"group_id": {"type": "string", "minLength": 1}, "group_type": {"enum": ["EXACT_DISTANCE_POLICY_GROUP", "APPROXIMATE_DISTANCE_POLICY_GROUP", "TOLERANCE_BOUND_POLICY_GROUP", "NOT_COMPUTABLE_POLICY_GROUP", "MANUAL_REVIEW_POLICY_GROUP"]}, "description": {"type": "string", "minLength": 1}, "applicable_fixture_family": {"enum": ["VALID_FIXTURES", "INVALID_FIXTURES", "NOT_COMPUTABLE_FIXTURES", "MIXED_FIXTURES"]}, "distance_value_status": {"enum": ["NOT_ADDED", "HELD_PENDING_IMPLEMENTATION", "HELD_PENDING_OPERATOR_REVIEW", "NOT_COMPUTABLE_ONLY"]}, "tolerance_required": {"type": "boolean"}, "review_required": {"type": "boolean"}, "implementation_status": {"enum": ["PLANNED_ONLY", "NOT_IMPLEMENTED", "BLOCKED_PENDING_REVIEW"]}}}},
    "tolerance_policy_plan": {"type": "object", "additionalProperties": false, "required": ["tolerance_policy_declared", "absolute_tolerance_declared", "relative_tolerance_declared", "floating_point_policy_declared", "tolerance_values_added", "tolerance_execution_enabled"], "properties": {"tolerance_policy_declared": {"const": true}, "absolute_tolerance_declared": {"const": true}, "relative_tolerance_declared": {"const": true}, "floating_point_policy_declared": {"const": true}, "tolerance_values_added": {"const": false}, "tolerance_execution_enabled": {"const": false}}},
    "not_computable_distance_policy": {"type": "object", "additionalProperties": false, "required": ["not_computable_policy_declared", "expected_not_computable_state_declared", "expected_distance_value_allowed_for_not_computable", "runtime_not_computable_enabled"], "properties": {"not_computable_policy_declared": {"const": true}, "expected_not_computable_state_declared": {"const": true}, "expected_distance_value_allowed_for_not_computable": {"const": false}, "runtime_not_computable_enabled": {"const": false}}},
    "review_gate_plan": {"type": "object", "additionalProperties": false, "required": ["operator_review_required", "expected_values_require_new_pr", "fixture_files_require_new_pr", "baseline_implementation_required_before_values", "no_authority_scan_required", "policy_only_no_values"], "properties": {"operator_review_required": {"const": true}, "expected_values_require_new_pr": {"const": true}, "fixture_files_require_new_pr": {"const": true}, "baseline_implementation_required_before_values": {"const": true}, "no_authority_scan_required": {"const": true}, "policy_only_no_values": {"const": true}}},
    "policy_constraints": {"type": "object", "additionalProperties": false, "required": ["expected_distances_added", "tolerance_values_added", "fixture_files_added", "metric_values_added", "chamfer_math_added", "scoring_added", "runtime_binding_added", "forecast_influence_added"], "properties": {"expected_distances_added": {"const": false}, "tolerance_values_added": {"const": false}, "fixture_files_added": {"const": false}, "metric_values_added": {"const": false}, "chamfer_math_added": {"const": false}, "scoring_added": {"const": false}, "runtime_binding_added": {"const": false}, "forecast_influence_added": {"const": false}}},
    "output_contract": {"type": "object", "additionalProperties": false, "required": ["emits_expected_distances", "emits_tolerance_values", "emits_fixture_files", "emits_metric_values", "emits_chamfer_outputs", "emits_scores", "emits_runtime_controls", "emits_authority_tokens", "emits_policy_plan", "emits_review_gate_metadata"], "properties": {"emits_expected_distances": {"const": false}, "emits_tolerance_values": {"const": false}, "emits_fixture_files": {"const": false}, "emits_metric_values": {"const": false}, "emits_chamfer_outputs": {"const": false}, "emits_scores": {"const": false}, "emits_runtime_controls": {"const": false}, "emits_authority_tokens": {"const": false}, "emits_policy_plan": {"const": true}, "emits_review_gate_metadata": {"const": true}}},
    "governance_flags": {"type": "object", "additionalProperties": false, "required": ["production_activation", "canon_promotion", "scheduler_mutation", "runtime_authority", "runtime_mutation", "forecast_influence", "execution_authority", "token_minting_allowed", "valid_for_execution", "activation_approved", "authorization_granted"], "properties": {"production_activation": {"const": false}, "canon_promotion": {"const": false}, "scheduler_mutation": {"const": false}, "runtime_authority": {"const": false}, "runtime_mutation": {"const": false}, "forecast_influence": {"const": false}, "execution_authority": {"const": false}, "token_minting_allowed": {"const": false}, "valid_for_execution": {"const": false}, "activation_approved": {"const": false}, "authorization_granted": {"const": false}}},
    "provenance": {"type": "object", "additionalProperties": true, "required": ["source", "evidence_refs", "generated_by", "upstream_schema_refs"], "properties": {"source": {"type": "string", "minLength": 1}, "evidence_refs": {"type": "array", "items": {"type": "string", "minLength": 1}}, "generated_by": {"type": "string", "minLength": 1}, "upstream_schema_refs": {"type": "array", "items": {"type": "string", "minLength": 1}}}},
    "created_at_utc": {"type": "string", "minLength": 1},
    "canonical_hash": {"type": "string", "pattern": "^[0-9a-f]{64}$"}
  }
}
