{"canonical_hash":"c65f37bb9af726d096005240464c3486a561b131685257980e0bda63d8f4cd39","created_at_utc":"2026-05-30T00:00:00Z","expected_distance_policy_groups":[{"applicable_fixture_family":"VALID_FIXTURES","description":"Tolerance policy metadata for future valid fixture expected-distance introduction.","distance_value_status":"HELD_PENDING_OPERATOR_REVIEW","group_id":"group-001","group_type":"TOLERANCE_BOUND_POLICY_GROUP","implementation_status":"PLANNED_ONLY","review_required":true,"tolerance_required":true}],"governance_flags":{"activation_approved":false,"authorization_granted":false,"canon_promotion":false,"execution_authority":false,"forecast_influence":false,"production_activation":false,"runtime_authority":false,"runtime_mutation":false,"scheduler_mutation":false,"token_minting_allowed":false,"valid_for_execution":false},"not_computable_distance_policy":{"expected_distance_value_allowed_for_not_computable":false,"expected_not_computable_state_declared":true,"not_computable_policy_declared":true,"runtime_not_computable_enabled":false},"operator_id":"CHAMFER_DISTANCE","output_contract":{"emits_authority_tokens":false,"emits_chamfer_outputs":false,"emits_expected_distances":false,"emits_fixture_files":false,"emits_metric_values":false,"emits_policy_plan":true,"emits_review_gate_metadata":true,"emits_runtime_controls":false,"emits_scores":false,"emits_tolerance_values":false},"plan_id":"chamfer_expected_distance_policy_plan_001","plan_type":"CHAMFER_EXPECTED_DISTANCE_POLICY_PLAN","policy_constraints":{"chamfer_math_added":false,"expected_distances_added":false,"fixture_files_added":false,"forecast_influence_added":false,"metric_values_added":false,"runtime_binding_added":false,"scoring_added":false,"tolerance_values_added":false},"policy_scope":{"intended_lane":"SHADOW","policy_family":"EXPECTED_DISTANCE_POLICY","policy_stage":"POLICY_PLAN_ONLY"},"provenance":{"evidence_refs":["ChamferFixtureImplementationReadinessReview.v1:chamfer_fixture_implementation_readiness_review_001"],"generated_by":"PATCH_CHAMFER_EXPECTED_DISTANCE_POLICY_PLAN_001","source":"CHAMFER_EXPECTED_DISTANCE_POLICY_PLAN_001","upstream_schema_refs":["contracts/canon/chamfer_expected_distance_policy_plan.v1.schema.json"]},"review_gate_plan":{"baseline_implementation_required_before_values":true,"expected_values_require_new_pr":true,"fixture_files_require_new_pr":true,"no_authority_scan_required":true,"operator_review_required":true,"policy_only_no_values":true},"schema_version":"ChamferExpectedDistancePolicyPlan.v1","source_baseline_implementation_plan_refs":["ChamferBaselineImplementationPlan.v1:chamfer_baseline_implementation_plan_001"],"source_fixture_consolidation_receipt_refs":["ChamferFixturePlanConsolidationReceipt.v1:chamfer_fixture_plan_consolidation_receipt_001"],"source_fixture_readiness_review_refs":["ChamferFixtureImplementationReadinessReview.v1:chamfer_fixture_implementation_readiness_review_001"],"source_invalid_fixture_plan_refs":["ChamferInvalidFixtureImplementationPlan.v1:chamfer_invalid_fixture_implementation_plan_001"],"source_not_computable_fixture_plan_refs":["ChamferNotComputableFixtureImplementationPlan.v1:chamfer_not_computable_fixture_implementation_plan_001"],"source_valid_fixture_plan_refs":["ChamferValidFixtureImplementationPlan.v1:chamfer_valid_fixture_implementation_plan_001"],"tolerance_policy_plan":{"absolute_tolerance_declared":true,"floating_point_policy_declared":true,"relative_tolerance_declared":true,"tolerance_execution_enabled":false,"tolerance_policy_declared":true,"tolerance_values_added":false}}
